Morris County Vocational School District,http://www.mcvts.org
Morris Hills Regionalschool District,http://www.mhrd.org
Morris Plains School District,http://MORRISPLAINSSCHOOLDISTRICT.ORG
Morris School District,http://www.morrisschooldistrict.org
Morris-Union Jointure Commisson School District,http://www.mujc.org
Mount Arlington Public School District,http://www.mtartlingtonk8.org
Mount Holly Township Public School District,http://www.mtholly.k12.nj.us
Mount Laurel Township School District,http://mtlaurelschools.org
Mount Olive Township School District,http://www.mtoliveboe.org
Mountain Lakes Board Of Education School District,http://www.mlschools.org/district
Mountainside School District,http://www.mountainsideschools.org
Mt. Ephraim School District,http://www.mtephraimschools.org
Mullica Township School District,http://www.mullica.k12.nj.us
National Park Boro School District,http://www.npelem.com
Neptune City School District,http://WWW.NEPTUNECITYSCHOOL.ORG
Neptune Township School District,http://www.neptune.k12.nj.us
Netcong Elementary School District,http://www.netcongschool.org
New Brunswick Public School District,http://www.nbps.k12.nj.us
New Hanover Township School District,http://newhanover.k12.nj.us
New Horizons Community Charter School,http://www.nhccschool.org
New Milford School District,http://www.newmilfordschools.org
New Providence Board Of Education School District,http://www.npsd.k12.nj.us
Newark Educators Community Charter School,http://newarkeducators.org
Newark Prep Charter School,http://www.newarkprep.com
Newton Public School District,http://www.newtonnj.org
North Arlington School District,http://www.narlington.k12.nj.us
North Bergen School District,http://www.northbergen.k12.nj.us
North Brunswick Township Public School District,http://www.nbtschools.org
North Caldwell Board Of Education School District,http://www.ncboe.org
North Haledon School District,http://www.nhschools.net
North Hanover Township School District,http://www.nhanover.com
North Hunterdon-Voorhees Regional High School District,http://www.nhvweb.net
North Plainfield Boro School District,http://www.nplainfield.org
North Star Academy Charter School Of Newark,http://www.northstaracademy.org
North Warren Regional School District,http://www.northwarren.org
North Wildwood School District,http://www.mmace.com
Northern Burlington County Regional School District,http://www.nburlington.com
Northern Highlands Regional High School District,http://www.northernhighlands.org
Northern Valley Regional High School District,http://www.nvnet.org
Northfield City School District,http://www.ncs-nj.org
Northvale Public School District,http://www.NORTHVALESCHOOL.ORG
Norwood Public School District,http://www.wearenorwood.org
Nutley Public School District,http://www.nutleyschools.org
Oakland Board Of Education School District,http://www.oaklandschoolsnj.org
Oaklyn Public School District,http://www.oaklynschool.org
Ocean City School District,http://www.oceancityschools.org
Ocean County Vocational Technical School District,http://www.ocvts.org
Ocean Gate School District,http://www.oceangateschool.net
Ocean Township School District,http://www.otsdk6.org
Oceanport School District,http://oceanport.k12.nj.us
Office Of Education Department Of Children And Families School District,NA
Office Of Education Juvenile Justice Commission School District,NA
Ogdensburg Borough School District,http://www.obboe.org
Old Bridge Township School District,http://www.oldbridgeadmin.org
Old Tappan Public School District,http://www.oldtappanschools.org
Oldmans Township School District,http://WWW.OLDMANS.ORG
Oradell School District,http://oradellschool.org
Orange Board Of Education School District,http://www.orange.k12.nj.us
Oxford Township School District,http://www.oxfordcentral.org
Palisades Park Board Of Education School District,http://palpkschools.org
Palmyra Public School District,http://palmyraschools.com/ps/
Paramus Public School District,http://www.paramus.k12.nj.us
Park Ridge Public School District,http://www.parkridge.k12.nj.us
Parsippany-Troy Hills Township School District,http://www.pthsd.k12.nj.us
Pascack Valley Regional High School District,http://www.pascack.k12.nj.us
Passaic Arts And Science Charter School,http://www.passaiccharter.org
Passaic City Public School District,http://www.passaicschools.org/
Passaic County Educational Services Commission School District,http://www.pcesc.org
Passaic County Manchester Regional High School District,http://WWW.MRHS.NET
Passaic County Vocational School District,http://www.pcti.tec.nj.us
Passaic Valley Regional High School District #1,http://www.pvhs.k12.nj.us
Paterson Arts And Science Charter School,http://www.patersoncharter.org
Paterson Charter School For Science And Technology,http://www.pcsst.org
Paterson Public School District,http://www.paterson.k12.nj.us
Paul Robeson Charter School For The Humanities,http://www.paulrobesoncs.org
Paulo Freire Charter School,http://www.thefreireschool.org
Paulsboro Public School District,http://WWW.PAULSBORO.K12.NJ.US
Pemberton Township School District,http://www.pemberton.k12.nj.us
Penns Grove-Carneys Point Regional School District,http://www.pgcpschools.org
Pennsauken Township Board Of Education School District,http://PENNSAUKEN.NET
Pennsville Public School District,http://www.psdnet.org
Peoples Preparatory Charter School,http://peoplesprepnewark.org
Pequannock Township School District,http://www.pequannock.org
Perth Amboy Public School District,http://www.paps.net
Philips Academy Charter School Of Paterson,http://www.pacspaterson.org
Phillip's Academy  Charter School,http://www.pacsnewark.org
Phillipsburg School District,http://www.pburgsd.net
Pine Hill Borough Board Of Education School District,http://www.pinehill.k12.nj.us
Pinelands Regional School District,http://www.pinelandsregional.org
Piscataway Township School District,http://www.piscatawayschools.org
Pitman Boro Public School District,http://pitman.k12.nj.us
Pittsgrove Township Board Of Education School District,http://www.pittsgrove.net
Plainfield Public School District,http://www.plainfieldnjk12.org
Pleasantville Public School District,http://www.pps-nj.us/pps/
Plumsted Township Board Of Education School District,http://www.newegypt.us
Pohatcong Township School District,http://www.pohatcong.org
Point Pleasant Beach Board Of Education School District,http://www.ptbeach.com
Point Pleasant Borough Board Of Education School District,http://www.pointpleasant.k12.nj.us
Pompton Lakes Boro School District,http://www.plps-k12.org/
Port Republic School District,http://www.portnj.org
Pride Academy Charter School,http://www.prideacs.org
Princeton Charter School,http://www.pcs.k12.nj.us
Princeton Public School District,http://www.princetonk12.org
Prospect Park School District,http://www.prospectparknj.com
Quinton Township Board Of Education School District,http://quinton.nj.schoolwebpages.com
Rahway Public School District,http://www.rahway.net
Ramapo Indian Hills Regional High School District,http://www.rih.org
Ramsey Public School District,http://WWW.RAMSEY.K12.NJ.US
Rancocas Valley Regional High School District,http://www.rvrhs.com
Randolph Township School District,http://www.rtnj.org
Readington Township Public School District,http://www.readington.k12.nj.us
Red Bank Borough Public School District,http://www.rbb.k12.nj.us
Red Bank Charter School,http://www.redbankcharterschool.com
Red Bank Regional School District,http://www.rbrhs.org
Ridge And Valley Charter School,http://www.ridgeandvalley.org
Ridgefield Park Township School District,http://www.rpps.net
Ridgefield Public School District,http://www.ridgefieldschools.com
Ridgewood Public School District,http://www.ridgewood.k12.nj.us/
Ringwood School District,http://www.ringwoodschools.org
River Dell Regional School District,http://www.riverdell.org
River Edge School District,http://www.riveredgeschools.org
River Vale Publc School District,http://www.rivervaleschools.com
Riverbank Charter School,http://riverbank.charter.k12.nj.us
Riverdale School District,http://www.rpsnj.org
Riverside Township School District,http://www.riverside.k12.nj.us
Riverton School District,http://www.riverton.k12.nj.us
Robbinsville Public School District,http://www.robbinsville.k12.nj.us
Robert Treat Academy Charter School,http://www.RobertTreatAcademy.org
Rochelle Park School District,http://rp.bergen.org
Rockaway Borough Public School District,http://www.rockboro.org
Rockaway Township School District,http://www.rocktwp.org
Roosevelt Public School District,http://www.rps1.org
Roseland School District,http://www.roselandnjboe.org
Roselle Park Board Of Education School District,http://www.rpsd.org
Roselle Public School District,http://WWW.ROSELLESCHOOLS.ORG
Roseville Community Cs,http://www.rosevillecharter.org
Roxbury Township School District,http://www.roxbury.org
Rumson Borough School District,http://www.rumsonschool.org
Rumson-Fair Haven Regional High School District,http://www.rumsonfairhaven.org
Runnemede Public School District,http://www.runnemedeschools.org
Rutherford Public School District,http://www.rutherfordschools.org
Saddle Brook Township Board Of Education School District,http://www.saddlebrookschools.org
Saddle River School District,http://wandellschool.org
Salem City Board Of Education School District,http://www.SALEMNJ.ORG
Salem County Special Services School District,http://scsssd.org
Salem County Vocational Technical School District,http://www.scvts.org
Sandyston-Walpack Consolidated School District,http://www.sandystonwalpack.org
Sayreville Public School District,http://www.sayrevillek12.net
Scotch Plains-Fanwood School District,http://www.spfk12.org
Sea Girt Borough Public School District,http://www.seagirt.k12.nj.us
Seaside Heights School District,http://www.sshschool.org/
Secaucus Board Of Education School District,http://www.sboe.us
Shamong Township School District,http://www.shamongschools.org
Shore Regional High School District,http://www.shoreregional.org
Shrewsbury Borough School District,http://www.sbs.k12.nj.us/sbs
Soaraing Heights Charter School,http://www.soaringheightscharterschool.com
Somerdale Public School District,http://www.somerdale-park.org
Somers Point School District,http://www.sptsd.org
Somerset County Educational Services Commission School District,http://www.sc.esc.k12.nj.us
Somerset County Vocational And Technical School District,http://www.scvths.org
Somerset Hills Regional School District,http://www.shsd.org/
Somerville Borough School District,http://WWW.SOMERVILLENJK12.ORG
South  Bergen Jointure Commission School District,http://www.njsbjc.org
South Amboy School District,http://www.sapublicschools.com
South Bound Brook Public School District,http://www.rmschool.com
South Brunswick School District,http://www.sbschools.org
South Hackensack School District,http://www.shmemorial.org
South Harrison Township School District,http://www.southharrison.k12.nj.us
South Hunterdon Regional School District,http://www.shrsd.org
South Orange-Maplewood School District,http://www.somsd.k12.nj.us
South Plainfield Public School District,http://www.spboe.org
South River Public School District,http://srivernj.org
Southampton Township School District,http://www.southampton.k12.nj.us
Southern Regional School District,http://www.srsd.net
Sparta Township Public School District,http://www.sparta.org
Spotswood Public School District,http://www.spotswood.k12.nj.us
Spring Lake Borough School District,http://www.hwmountz.k12.nj.us
Spring Lake Heights School District,http://www.slheights.org
Springfield Public School District,http://www.springfieldschools.com
Springfield Township School District,http://www.springfieldschool.org
Stafford Township School District,http://www.staffordschools.org
Stanhope School District,http://www.stanhopeschools.org
Sterling School District,http://www.sterling.k12.nj.us
Stillwater Township School District,http://www.stillwaterschool.net
Stone Harbor Elementary School District,http://www.shesnj.org
Stow Creek Township School District,http://www.stowcreekschool.com
Stratford School District,http://www.stratford.k12.nj.us
Summit Public School District,http://www.summit.k12.nj.us
Sussex County Charter School For Technology,http://www.sussexcharter.org
Sussex County Educational Services Commission School District,http://www.sussexesc.org
Sussex County Technical School District,http://www.sussextech.org
Sussex-Wantage Regional School District,http://www.swregional.org
Swedesboro-Woolwich Board Of Education School District,http://WWW.SWEDESBORO-WOOLWICH.COM
Tabernacle Township School District,http://www.tabschools.org
Team Academy Charter School,http://www.teamschools.org
Teaneck Community Charter School,http://www.tccsnj.org
Teaneck Public School District,http://www.teaneckschools.org
Tenafly Public School District,http://tenafly.k12.nj.us
Tewksbury Township School District,http://www.tewksburyschools.org
The Barack Obama Green Charter High,http://www.obamagreencharter.org
The Ethical Community Charter School,http://www.teccs-jc.org/
The Kingdom Charter School Of Leadership School District,http://www.thekingdomcharter.org
The Learning Community Charter School,http://www.lccsnj.org
The Newark Public School District,http://WWW.NPS.K12.NJ.US
The Queen City Academy Charter School,http://www.queencity.edu
The School District Of The Chathams,http://www.chatham-nj.org
The Village Charter School,http://www.villagecharter.org
Thomas Edison Energysmart Charter School,http://www.energysmartschool.org
Tinton Falls School District,http://www.tfs.k12.nj.us
Toms River Regional School District,http://www.trschools.com
Totowa Public School District,http://www.totowa.k12.nj.us
Township Of Ocean School District,http://www.oceanschools.org
Trenton Public School District,http://www.trenton.k12.nj.us
Trenton Stem-To-Civics Charter School,http://www.stemcivics.org
Tuckerton Borough School District,http://www.tuckerton.k12.nj.us
Twp Of Union Board Of Education School District,http://www.twpunionschools.org
Union Beach Public School District,http://www.unionbeachschools.org
Union City School District,http://www.union-city.k12.nj.us
Union County Educational Services Commission School District,http://www.ucesc.org
Union County Teams Charter School-High School,http://www.ucteams.org
Union County Vocational-Technical School District,http://www.ucvts.tec.nj.us
Union Township School District,http://www.uniontwpschool.org
Unity Charter School,http://www.unitycharterschool.org
University Academy Charter High School,http://www.uachs.org
University Heights Charter School,http://www.uhcs-newark.org
Upper Deerfield Township School District,http://www.upperdeerfieldschools.org
Upper Freehold Regional School District,http://www.ufrsd.net
Upper Pittsgrove Twp School District,http://upperpitts.org/
Upper Saddle River School District,http://www.usrschoolsk8.com
Upper Township School District,http://www.upperschools.org
Ventnor City School District,http://www.veccnj.org
Vernon Township School District,http://www.vtsd.com
Verona  Public School District,http://www.veronaschools.org
Vineland Public Charter School,http://www.vinelandpubliccharterschool.org/
Voorhees Township Board Of Education School District,http://www.voorhees.k12.nj.us
Waldwick School District,http://www.waldwick.k12.nj.us
Wall Township Public School District,http://www.wall.k12.nj.us
Wallington Boro School District,http://www.wboe.org
Wallkill Valley Regional High School District,http://WWW.WALLKILL.K12.NJ.US
Wanaque Public School District,http://www.wanaqueps.org
Warren County Special Services School District,http://www.wcsssd.org
Warren County Technical School District,http://www.wctech.org
Warren Hills Regional School District,http://www.warrenhills.org
Warren Township School District,http://www.warrentboe.org
Washington Borough School District,http://www.washboroschools.org
Washington Township Public School District,http://www.wtschools.org
Washington Township Public School District,http://www.wtschools.org
Washington Township School District,http://www.wtps.org
Watchung Borough Public School District,http://www.watchungschools.com
Watchung Hills Regional High School District,http://www.whrhs.org
Waterford Township Public School District,http://www.wtsd.org
Wayne Township Public School District,http://WWW.WAYNESCHOOLS.COM
Weehawken Board Of Education School District,http://weehawkenschools.net
Wenonah Boro School District,http://www.wenonahschool.org
West Cape May Elementary School District,http://wcm.capemayschools.com
West Deptford Township Public School District,http://www.wdeptford.k12.nj.us
West Essex Regional School District,http://www.westex.org
West Long Branch Board Of Education School District,http://wlbschools.com
West Milford Township Public School District,http://www.wmtps.org
West Morris Regional High School District,http://WWW.WMRHSD.ORG
West New York Board Of Education School District,http://www.wnyschools.net
West Orange Public School District,http://www.woboe.org
West Windsor-Plainsboro Regional School District,http://www.ww-p.org/
Westampton Township Public School District,http://www.westamptonschools.org
Westfield Public School District,http://www.westfieldnjk12.org
Westville Boro Public School District,http://www.westvillesd.com
Westwood Regional School District,http://www.wwrsd.org
Weymouth Township School District,http://www.weymouthtownshipschool.com
Wharton Borough Board Of Education School District,http://www.wbps.org
White Township School District,http://www.whitetwpsd.org
Wildwood City Board Of Education School District,http://WWW.WILDWOODDISTRICT.ORG
Wildwood Crest Borough School District,http://WWW.CRESTMEM.EDU
Willingboro Public School District,http://www.willingboroschools.org
Winfield Township School District,http://www.winfieldschool.org
Winslow Township School District,http://www.winslow-schools.com
Wood-Ridge Board Of Education School District,http://www.wood-ridgeschools.org
Woodbine School District,http://woodbine.capemayschools.com
Woodbridge Township School District,http://www.woodbridge.k12.nj.us/district.html
Woodbury City Public School District,http://www.woodburysch.com
Woodbury Heights Public School District,http://www.woodburyhtselem.com
Woodcliff Lake School District,http://www.woodcliff-lake.com
Woodland Park Public School District,http://www.wpschools.org
Woodland Township Board Of Education School District,http://www.woodlandboe.org
Woodlynne Boro Public School District,http://www.woodlynne.k12.nj.us
Woodstown-Pilesgrove Regional School District,http://www.woodstown.org
Wyckoff Township Public School District,http://www.wyckoffps.org
