Absecon Public School District,http://www.edline.net/pages/abseconschooldistrict
Academy Charter High School,http://www.academycharterhs.org
Academy For Urban Leadership,http://www.aulchs.org
Alexandria Township School District,http://www.alexandriaschools.org
Allamuchy Township School District,http://www.aes.k12.nj.us
Allendale Board Of Education School District,http://www.allendalek8.com
Alloway Twp School District,http://www.allowayschool.org
Alpha Borough Public School District,http://www.apsedu.org
Alpine Elementary School District,http://www.alpineschool.org
Andover Regional School District,http://www.andoverregional.org
Area Vocational Technical School District Of Mercer County,http://www.mcts.edu
Asbury Park School District,http://www.asburypark.k12.nj.us
Atlantic City Public School District,http://www.acboe.org
Atlantic Community Charter School,http://www.atlanticcitycharter.com
Atlantic County Special Services School District,http://www.acsssd.net
Atlantic County Vocational School District,http://www.acitech.org
Atlantic Highlands School District,http://www.ahes.k12.nj.us
Audubon Public School District,http://www.audubonschools.org
Avalon Elementary School District,http://WWW.AVESNJ.ORG
Avon-By-The-Sea School District,http://WWW.AVONSCHOOL.COM
Barnegat Township School District,http://www.barnegatschools.com
Barrington School District,http://www.barringtonschools.net
Bass River Township Board Of Education School District,http://WWW.BASSRIVERSCHOOLDISTRICT.ORG
Bay Head Borough School District,http://www.bayheadschool.org
Bayonne Board Of Education School District,http://www.bboed.org
Bayshore Jointure Commission School District,http://www.theshorecenter.org
Beach Haven School District,http://www.BeachHavenSchool.com
Bedminster Township Public School District,http://www.bedminsterschool.org
Belleville Public School District,http://www.bellevilleschools.org
Bellmawr Public School District,http://www.bellmawrschools.org
Belmar Board Of Education School District,http://www.belmar.k12.nj.us
Beloved Community Charter School,http://www.belovedccs.org
Belvidere School District,http://www.belvideresd.org
Benjamin Banneker Preparatory Charter School,http://www.bannekerprep.com
Bergen Arts And Sciences Charter School,http://www.bergencharter.org
Bergen County Special Services School District,http://bcss.bergen.org
Bergen County Vocational Technical School District,http://bcts.bergen.org
Bergenfield Borough School District,http://www.bergenfield.org
Berkeley Heights Public School District,http://www.bhpsnj.org
Berkeley Township School District,http://www.btboe.org
Berlin Borough School District,http://www.bcsberlin.k12.nj.us
Berlin Township School District,http://www.btwpschools.org
Bernards Township Public School District,http://www.bernardsboe.com
Bethlehem Township School District,http://www.btschools.org
Beverly City School District,http://www.beverlycityschool.org
Black Horse Pike Regional School District,http://www.bhprsd.org
Blairstown Elementary Township School District,http://www.blairstownelem.net
Bloomfield Board Of Education School District,http://www.bloomfield.k12.nj.us
Bloomingdale School District,http://www.bloomingdaleschools.org
Bloomsbury School District,http://www.bburyes.com
Bogota Public School District,http://www.bogotaboe.com
Boonton Town School District,http://www.boontonschools.org
Boonton Township Public School District,http://www.rvsnj.org
Bordentown Regional School District,http://www.bordentown.k12.nj.us
Bound Brook School District,http://www.bbrook.org
Bradley Beach Elementary School District,http://www.bbesnj.org
Branchburg Township School District,http://www.branchburg.k12.nj.us
Brick Township Public School District,http://www.brickschools.org
Bridgeton Public Charter School,http://www.bridgetonpubliccharterschool.org
Bridgeton Public School District,http://www.Bridgeton.k12.nj.us
Bridgewater-Raritan Regional School District,http://brrsd.k12.nj.us
Brielle Boro School District,http://www.brielle.k12.nj.us
Brigantine Public School District,http://www.brigantineschools.org
Brooklawn Public School District,http://www.alicecostello.com
Buena Regional School District,http://WWW.BUENA.K12.NJ.US
Burch Charter School Of Excellence,http://www.burchcharterschool.org
Burlington City  Public School District,http://www.burlington-nj.net/
Burlington County Institute Of Technology School District,http://www.bcit.cc
Burlington County Special Services School District,http://www.bcsssd.k12.nj.us
Burlington Township Board Of Education School District,http://www.burltwpsch.org
Butler Public School District,http://www.butlerboe.org
Byram Township Board Of Education School District,http://www.byramschools.org
Caldwell-West Caldwell Public School District,http://www.cwcboe.org
Califon School District,http://www.califonschool.org
Camden City Public School District,http://WWW.CAMDEN.K12.NJ.US
Camden Community Charter School,http://CamdenCharter.com
Camden County Technical School District,http://www.ccts.org
Camden Prep INC.,http://www.camdenprep.uncommonschools.org
Camdens Promise Charter School,http://www.promiseacademycharter.org
Cape May City Board Of Education School District,http://www.cmcboe.org
Cape May County Special Services School District,http://www.cmcspecialservices.org
Cape May County Technical High School District,http://www.capemaytech.com
Carlstadt Public School District,http://www.carlstadt.org
Carlstadt-East Rutherford Regional High School District,http://www.bectonhs.org
Carteret Public School District,http://www.carteretschools.org
Cedar Grove Township School District,http://www.cedargrove.k12.nj.us/
Central Jersey College Prep Charter School,http://www.cjcollegeprep.org
Central Regional School District,http://www.centralreg.k12.nj.us
Charter Technical High School For The Performing Arts,http://www.chartertech.org
Cherry Hill Township School District,http://www.chclc.org
Chester School District,http://www.chester-nj.org
Chesterfield Township School District,http://www.chesterfieldschool.com
Cinnaminson Township Public School District,http://www.cinnaminson.com
City Of Vineland Board Of Education School District,http://www.vineland.org
Clark Township Public School District,http://www.clarkschools.org
Classical Academy Charter School Of Clifton,http://www.classicalacademy.org
Clayton Public School District,http://www.claytonps.org
Clearview Regional High School District,http://www.clearviewregional.edu
Clementon Elementary School District,http://clementon.k12.nj.us
Cliffside Park School District,http://www.cliffsidepark.edu
Clifton Public School District,http://www.clifton.k12.nj.us/
Clinton Township School District,http://www.ctsd.k12.nj.us
Clinton-Glen Gardner Board Of Education School District,http://cpsnj.org
Closter Public School District,http://www.closterschools.org
College Achieve Central Charter School,http://www.collegeachieve.org
Collingswood Public School District,http://www.collsk12.org
Colts Neck Township School District,http://www.coltsneckschools.org
Commercial Township School District,http://www.commercial.k12.nj.us
Community Charter School Of Paterson,http://www.ccsp.org
Compass Academy Charter School,http://www.compassacademycharter.org
Cranbury Township Board Of Education School District,http://www.cranburyschool.org
Cranford Public School District,http://cranfordschools.org
Cresskill Public School District,http://www.cboek12.org
Cresthaven Academy Charter School,http://www.cresthavenacademy.org
Cumberland County Board Of Vocational Education School District,http://www.cctecnj.org
Cumberland Regional School District,http://www.crhsd.org
Deal Boro School District,http://www.dealschool.org
Deerfield Township School District,http://www.deerfield.k12.nj.us
Delanco Township School District,http://www.delanco.com
Delaware Township School District,http://www.dtsk8.org
Delaware Valley Regional High School District,http://www.dvrhs.org
Delran Township School District,http://www.delranschools.org
Delsea Regional High School District,http://www.delsearegional.us
Demarest School District,http://demarestsd.schoolwires.net
Dennis Township School District,http://www.dennistwpschools.org
Denville Township Board Of Education School District,http://www.denville.org
Deptford Township Public School District,http://www.deptford.k12.nj.us
Discovery Charter School,http://www.discoverycs.org
Dover Public School District,http://district.dover-nj.org
Downe Township School District,http://www.downeschool.org
Dr Lena Edwards Academic Charter School,http://www.drlenaedwardscharterschool.org
Dumont Board Of Education School District,http://www.dumontnj.org
Dunellen Public School District,http://www.dunellenschools.org
Eagleswood Township School District,http://www.eagleswood.org
East Amwell Township School District,http://www.eastamwell.org
East Brunswick Public School District,http://www.ebnet.org
East Greenwich Township Board Of Education School District,http://www.eastgreenwich.k12.nj.us
East Hanover Township School District,http://www.easthanoverschools.org
East Newark School District,http://www.eastnewarkschool.org
East Orange Community Charter School,http://www.theeoccs.org
East Orange School District,http://www.eastorange.k12.nj.us
East Rutherford School District,http://www.erboe.net
East Windsor Regional School District,http://www.eastwindsorregionalschools.com
Eastampton Township School District,http://www.eastampton.k12.nj.us
Eastern Camden County Regional School District,http://www.eccrsd.us
Eatontown Public School District,http://www.eatontown.org
Edgewater Park Township School District,http://www.edgewaterparksd.org
Edgewater School District,http://www.edgewaterschools.org
Edison Township Public School District,http://www.edison.k12.nj.us
Educational Services Commission Of Morris County School District,http://www.escmorris.com
Educational Services Commission Of New Jersey,http://www.mresc.k12.nj.us
Egg Harbor City School District,http://www.ehcs.k12.nj.us
Egg Harbor Township School District,http://eht.k12.nj.us
Elizabeth Public School District,http://www.epsnj.org
Elk Township School District,http://www.elk.k12.nj.us
Elmwood Park Board Of Education School District,http://www.elmwoodparkschools.org
Elsinboro Township School District,http://www.elsinboroschool.org
Elysian Charter School,http://www.ecsnj.org
Emerson School District,http://www.emerson.k12.nj.us
Empowerment Academy Charter School,http://www.empacad.org
Englewood Cliffs Public School District,http://www.englewoodcliffs.org
Englewood On The Palisades Charter School,http://www.epcs.ws
Englewood Public School District,http://www.epsd.org
Environment Community Opportunity (Eco) Charter School,http://www.ecocharterschool.org
Essex County Vocational Technical School District,http://www.essextech.org
Essex Fells School District,http://www.efsk-6.org
Essex Regional Educational Services Commission School District,http://www.eresc.com
Estell Manor City School District,http://www.estellmanorschool.com
Evesham Township School District,http://www.evesham.k12.nj.us
Ewing Township Public School District,http://www.ewing.k12.nj.us
Fair Haven School District,http://www.fairhaven.edu
Fair Lawn Public School District,http://www.fairlawnschools.org
Fairfield Public School District,http://www.fpsk6.org
Fairfield Township School District,http://www.fairfield.k12.nj.us
Fairview Public School District,http://www.fairviewps.org
Farmingdale Board Of Education School District,http://farmingdaleschool.com
Flemington-Raritan Regional School District,http://www.frsd.k12.nj.us
Florence Township School District,http://www.florence.k12.nj.us
Florham Park Public School District,http://www.fpks.org
Folsom Borough School District,http://www.folsomschool.org/
Fort Lee Public School District,http://www.flboe.com
Foundation Academy Charter School,http://www.foundationacademies.org
Frankford Township School District,http://www.frankfordschool.org
Franklin Borough School District,http://www.fboe.org
Franklin Lakes Public School District,http://www.franklinlakes.k12.nj.us
Franklin Township Board Of Education School District,http://www.franklintwpschools.org
Franklin Township Public School District,http://www.franklinboe.org
Franklin Township School District,http://www.ftschool.org
Franklin Township School District,http://www.ftschool.org
Fredon Township School District,http://www.fredon.org
Freedom Academy Charter School,http://www.democracyprep.org/schools/about/freedom-prep-charter-school
Freehold Borough Public School District,http://www.freeholdboro.k12.nj.us
Freehold Regional High School District,http://www.frhsd.com
Freehold Township School District,http://www.freeholdtwp.k12.nj.us
Frelinghuysen Township School District,http://WWW.FRELINGHUYSENSCHOOL.ORG
Frenchtown School District,http://teacherweb.com/NJ/Frenchtownschool/SchoolWebsite/
Galloway Township Public School District,http://WWW.GTPS.K12.NJ.US
Garfield Public School District,http://GBOE.ORG
Garwood Boro School District,http://www.garwoodschools.org
Gateway Regionalschool District,http://www.gatewayhs.com
Gibbsboro Elementary School District,http://www.gibbsboroschool.org
Glassboro Public School District,http://www.glassboroschools.us
Glen Ridge Public School District,http://www.glenridge.org
Glen Rock Public School District,http://WWW.GLENROCKNJ.ORG
Gloucester City Public School District,http://gcsd.k12.nj.us
Gloucester County Special Services School District,http://www.gcsssd.org
Gloucester County Vocational-Technical School District,http://www.gcit.org
Gloucester Township Public School District,http://www.gloucestertownshipschools.org
Gray Charter School,http://www.graycharterschool.com
Great Futures Charter School,http://www.greatfuturescharterhs.org
Great Meadows Regional School District,http://www.gmrsd.com
Great Oaks Charter School,http://www.greatoakscharter.org
Greater Brunswick Charter School,http://www.greaterbrunswick.org
Greater Egg Harbor Regional High School District,http://www.gehrhsd.net
Green Brook Township Public School District,http://www.gbtps.org
Green Township School District,http://www.greenhills.org
Greenwich Township School District,http://www.morrisgoodwinschool.org
Greenwich Township School District,http://www.morrisgoodwinschool.org
Greenwich Township School District,http://www.morrisgoodwinschool.org
Guttenberg School District,http://www.alkschool.org
Hackensack City School District,http://hackensackschools.org
Hackettstown Public School District,http://www.hackettstown.org
Haddon Heights School District,http://www.hhsd.k12.nj.us
Haddon Township School District,http://HADDONTWPSCHOOLS.COM
Haddonfield Board Of Education School District,http://haddonfield.k12.nj.us
Hainesport Township School District,http://www.hainesport.k12.nj.us
Haledon Public School District,http://www.haledon.org
Hamburg School District,http://www.hamburgschool.com
Hamilton School District - Pace Charter School Of Hamilton,http://www.pace.charter.k12.nj.us
Hamilton Township Public School District,http://www.hamilton.k12.nj.us
Hamilton Township School District,http://www.hamiltonschools.org
Hammonton School District,http://www.hammontonps.org
Hampton Borough Public School District,http://hampton.nhvweb.net
Hampton Township School District,http://www.mckeown.org
Hanover Park Regional High School District,http://www.hpreg.org
Hanover Township Board Of Education School District,http://www.hanovertwpschools.org
Harding Township School District,http://www.hardingtwp.org
Hardyston Township School District,http://www.htps.org
Harmony Township School District,http://www.harmonytownshipschool.org
Harrington Park School District,http://www.hpsd.org
Harrison Public School District,http://www.harrisonschools.org
Harrison Township School District,http://www.harrisontwp.k12.nj.us
Hasbrouck Heights Board Of Education School District,http://www.hhschools.org
Hatikvah International Academy Charter School,http://www.hatikvahcharterschool.com
Haworth Public School District,http://www.haworth.org
Hawthorne Board Of Education School District,http://www.hawthorne.k12.nj.us
Hazlet Township Public School District,http://www.hazlet.org
Henry Hudson Regional School District,http://www.henryhudsonreg.k12.nj.us
High Bridge Borough School District,http://www.hbschools.org
High Point Regional High School District,http://www.hpregional.org
Highland Park Board Of Education School District,http://WWW.HPSCHOOLS.NET
Highlands Elementary School District,http://www.highlandselementary.org
Hillsborough Township Public School District,http://www.htps.us
Hillsdale Board Of Education School District,http://www.hillsdaleschools.com
Hillside Board Of Education School District,http://district.hillsidek12.org/
Ho-Ho-Kus School District,http://www.hohokus.org
Hoboken Charter School,http://www.hobokencs.org
Hoboken Dual Language Charter School,http://holahoboken.org/
Hoboken Public School District,http://www.hoboken.k12.nj.us
Holland Township School District,http://www.hollandschool.org
Holmdel Township School District,http://www.holmdelschools.org
Hopatcong Borough School District,http://www.hopatcongschools.org
Hope Academy Charter School,http://www.hopeacademycs.org
Hope Community Charter School,http://www.hopecommunitycharter.org/
Hope Township School District,http://www.hope-elem.org
Hopewell Township School District,http://hopewellcrest.org
Hopewell Valley Regional School District,http://www.hvrsd.org
Howell Township Public School District,http://WWW.HOWELL.K12.NJ.US
Hudson Arts and Sciences Charter,http://www.hudsoncharter.org
Hudson County School District Of Technology,http://www.hcstonline.org
Hunterdon Central Regional High School District,http://www.hcrhs.org
Hunterdon County Educational Services Commission School District,http://www.hunterdonesc.org
Hunterdon County Vocational School District,http://www.hcpolytech.org
International Academy Of Atlantic City Charter School,http://www.iaac.sabis.net
International Academy Of Trenton Charter School,http://www.iat.sabis.net
International Charter School Of Trenton,http://Internationalcs.org
Irvington Board Of Education School District,http://www.irvington.k12.nj.us/
Island Heights Board Of Education School District,http://www.islandheights.k12.nj.us
Jackson Township School District,http://www.jacksonsd.org
Jamesburg Public School District,http://www.jamesburg.org
Jefferson Township School District,http://www.jefftwp.org
Jersey City Community Charter School,http://www.jcccsonline.org
Jersey City Global Charter School,http://www.jcgcs.org
Jersey City Golden Door Charter School,http://www.goldendoorschool.org
Jersey City Public School District,http://www.jcboe.org
John P Holland Charter School,http://www.jphcs.org
Keansburg School District,http://www.keansburg.k12.nj.us
Kearny School District,http://kearnyschools.com
Kenilworth School District,http://www.kenilworthschools.com
Keyport Board Of Education School District,http://www.kpsdschools.org
Kingsway Regional School District,http://www.kingsway.k12.nj.us
Kingwood Township School District,http://WWW.KINGWOODSCHOOL.ORG
Kinnelon Board Of Education School District,http://www.kinnelonpublicschools.org
Kipp: Cooper Norcross A New Jersey Nonprofit Corporation,http://kippnj.org/schools/lanning-square-primary/
Kittatinny Regional School District,http://www.krhs.net
Knowlton Township Board Of Education School District,http://www.knowltonschool.com
Lacey Township School District,http://www.laceyschools.org
Lady Liberty Academy Charter School,http://www.llacs.org
Lafayette Township School District,http://www.ltes.org
Lakehurst Elementary School District,http://www.lakehurstschool.org
Lakeland Regional High School District,http://www.lakeland.k12.nj.us
Lakewood Township School District,http://www.lakewoodpiners.org
Lambertville Public School District,http://www.lpschool.org
Laurel Springs School District,http://www.laurelspringschool.org
Lavallette Borough Board Of Education School District,http://www.lavallettek12.org
Lawnside School District,http://lawnside.k12.nj.us
Lawrence Township Public School District,http://www.ltps.org
Lawrence Township School District,http://www.myronlpowell.org
Leap Academy University Charter School,http://www.leapacademycharter.org
Lebanon Borough School District,http://lbsd.schoolwires.com
Lebanon Township School District,http://www.lebtwpk8.org
Lenape Regional High School District,http://www.lrhsd.org
Lenape Valley Regional Highschool District,http://www.lvhs.org
Leonia Public School District,http://www.leoniaschools.org
Lincoln Park School District,http://www.lincolnparkboe.org
Linden City Board Of Education School District,http://www.linden.k12.nj.us
Lindenwold Board Of Education School District,http://www.lindenwold.k12.nj.us
Link Community Charter School,http://www.linkschool.org
Linwood City School District,http://www.linwoodschools.org
Little Egg Harbor Township School District,http://www.lehsd.k12.nj.us
Little Falls Township Public School District,http://www.lfschools.org
Little Ferry Public School District,http://www.littleferry.k12.nj.us
Little Silver Boro School District,http://WWW.LITTLESILVERSCHOOLS.ORG
Livingston Public School District,http://www.livingston.org
Lodi Public School District,http://www.lodi.k12.nj.us/
Logan Township School District,http://www.logan.k12.nj.us
Long Beach Island Consolidated School District,http://www.lbischools.org
Long Branch Public School District,http://www.longbranch.k12.nj.us
Long Hill Township School District,http://www.longhill.org
Lopatcong Township School District,http://www.lopatsd.org
Lower Alloways Creek School District,http://www.lacschool.org
Lower Cape May Regional School District,http://www.lcmrschools.com
Lower Township Elementary School District,http://www.lowertwpschools.com
Lumberton Township Board Of Education School District,http://www.lumberton.k12.nj.us
Lyndhurst School District,http://lyndhurstschools.net
M.E.T.S. Charter School,http://www.metscharterschool.org
Madison School District,http://www.madisonpublicschools.org
Magnolia School District,http://www.magnoliaschools.org
Mahwah Township Public School District,http://www.mahwah.k12.nj.us
Mainland Regional High School District,http://MAINLANDREGIONAL.NET
Manalapan-Englishtown Regional School District,http://www.mers.k12.nj.us
Manasquan School District,http://www.manasquanschools.org
Manchester Township School District,http://www.manchestertwp.org
Mannington Township School District,http://manningtonschool.org
Mansfield Township Elementary School District,http://www.mansfieldelementary.org
Mansfield Township School District,http://www.mansfieldschool.com
Mantua Township Board Of Education School District,http://www.mantuaschools.com
Manville Board Of Education School District,http://www.manvilleschools.org
Maple Shade School District,http://www.mapleshade.org
Margate City School District,http://www.margateschools.org
Maria Varisco Rogers Charter School,http://www.mvrogerscharter.org
Marie H. Katzenbach School For The Deaf,http://www.mksd.org
Marion P. Thomas Charter School,http://www.mptcs.org
Marlboro Township Board Of Education School District,http://www.marlboro.k12.nj.us
Mastery Schools Of Camden Inc.,http://www.masterynj.org
Matawan-Aberdeen Regional School District,http://www.marsd.org
Maurice River Township Elementary School District,http://www.mrtes.com
Maywood Board Of Education School District,http://WWW.MAYWOODSCHOOLS.ORG
Medford Lakes School District,http://www.medford-lakes.k12.nj.us
Medford Township Public School District,http://www.medford.k12.nj.us
Mendham Borough School District,http://www.mendhamboro.org
Mendham Township Board Of Education School District,http://www.mendhamtwp.org
Mercer County Special Services School District,http://www.mcsssd.org
Merchantville School District,http://www.merchantvilleschool.org
Merit Preparatory Charter School Of Newark,http://www.meritprepschools.org
Metuchen Public School District,http://www.metuchenschools.org
Middle Township Public School District,http://www.middletwp.k12.nj.us
Middlesex Borough Public School District,http://www.middlesex.k12.nj.us
Middlesex County Vocational And Technical School District,http://www.mcvts.net
Middletown Township Public School District,http://www.middletownk12.org
Midland Park Public School District,http://mpsnj.org
Milford Boro School District,http://www.milfordpublicschool.com
Millburn Township School District,http://www.millburn.org
Millstone Township School District,http://www.millstone.k12.nj.us
Milltown Borough Public School District,http://www.milltownps.org
Millville Board Of Education School District,http://mps.millvillenj.gov
Millville Public Charter School,http://millvillepubliccharterschool.org
Mine Hill Township School District,http://www.minehillcas.org
Monmouth Beach Elementary School District,http://MBSCHOOL.ORG
Monmouth County Vocational School District,http://www.mcvsd.org
Monmouth Regional School District,http://www.monmouthregional.net
Monmouth-Ocean Educational Services Commission School District,http://www.moesc.org
Monroe Township Board Of Education School District,http://WWW.MONROE.K12.NJ.US
Monroe Township Public School District,http://www.monroetwp.k12.nj.us/
Montague Township School District,http://WWW.MONTAGUESCHOOL.ORG
Montclair Public School District,http://www.montclair.k12.nj.us
Montgomery Township School District,http://www.mtsd.k12.nj.us
Montvale Board Of Education School District,http://www.montvalek8.org
Montville Township School District,http://www.montville.net
Moonachie School District,http://www.moonachieschool.org
Moorestown Township School District,http://www.mtps.com
